"YB69DGZF","journalArticle","2014","Young, Hillary S.; McCauley, Douglas J.; Pollock, Amanda; Dirzo, Rodolfo","Differential plant damage due to litterfall in palm-dominated forest stands in a Central Pacific atoll","Journal of Tropical Ecology","","0266-4674, 1469-7831","10.1017/S026646741400008X","https://www.cambridge.org/core/product/identifier/S026646741400008X/type/journal_article","High densities of palms are common in many tropical forests. In some cases, the dominance of palms has been associated with a depauperate understorey and high rates of native seedling mortality. A variety of different potential mechanisms has been suggested to explain the sustained palm dominance in the understorey and canopy of these forests. Working in a Cocos nucifera-dominated wet tropical forest at Palmyra Atoll in the central Paciﬁc, we examine how litterfall from this pantropical, and economically important palm, impacts seedling survival. We compare rates of litterfall, and rates of litterfall-associated damage, between forest stands dominated by C. nucifera (coconut palm) and forest stands with low abundance of C. nucifera. To assess litterfall damage we survey damage to both artiﬁcial seedlings (n = 711), outplanted real seedlings of two species (with and without protection via caging; n = 204), and standing rates of litterfall damage. We ﬁnd that rates of large-litterfall damage were an average of ﬁve times higher in sites with high densities of C. nucifera. Associated with these increases we observe that levels of physical damage to artiﬁcial model seedlings caused by litterfall over a 4-mo period increased from 4.9% in sites with low abundance of C. nucifera to 16.1% in sites with high abundance of C. nucifera. Extrapolated to annual rates, litterfall damage of this magnitude exceeds the average levels observed in other published studies. Living native seedlings also showed more than 300% higher levels of mortality in forest stands with high densities of C. nucifera, a difference that was greatly reduced when protected by caging from litterfall. In contrast, uncaged C. nucifera seedlings actually had slightly higher survivorship in habitats dominated by conspeciﬁcs. We suggest that litterfall damage may be an important mechanism by which this tropical palm reaches and maintains near monodominance in many coastal and insular habitats.","2014-05","2021-09-23 22:35:33","2021-09-23 22:35:33","2021-06-28 14:28:24","231-236","","3","30","","J. Trop. Ecol.","","","","","","","","en","","","","","DOI.org (Crossref)","","Number: 3","","","","cocos nucifera,; diversity,; establishment,; fragments,; impact; island,; litterfall,; mechanical damage,; palm,; physical damage,; rain-forest,; regeneration,; seedling mortality,; tree seedlings,; tropical moist forest,","","","","","","","","","","","","","","","","","","","","","","","","","","","","","","","","","","","","","","","","","","","","","","",""
"6F2QITU9","journalArticle","2017","Young, Hillary; Nigro, Katherine; McCauley, Douglas J.; Ballance, Lisa T.; Oleson, Erin M.; Baumann-Pickering, Simone","Limited trophic partitioning among sympatric delphinids off a tropical oceanic atoll","PLOS ONE","","1932-6203","10.1371/journal.pone.0181526","https://dx.plos.org/10.1371/journal.pone.0181526","","2017-08-02","2021-09-23 22:35:33","2021-09-23 22:35:33","2021-06-28 14:28:29","e0181526","","8","12","","PLoS ONE","","","","","","","","en","","","","","DOI.org (Crossref)","","Number: 8","","","","Animals,; Ecosystem,; Feeding Behavior/physiology,; Food Chain,; Behavior, Animal,; Biopsy,; Dolphins/classification/physiology,; Nutritional Status,; Remote Sensing Technology,; Skin/chemistry","","Gorokhova, Elena","","","","","","","","","","","","","","","","","","","","","","","","","","","","","","","","","","","","","","","","","","","","",""
"EMRDLMTG","journalArticle","2010","Zaunbrecher, Laura K.; Cobb, Kim M.; Beck, J. Warren; Charles, Christopher D.; Druffel, Ellen R. M.; Fairbanks, Richard G.; Griffin, Sheila; Sayani, Hussein R.","Coral records of central tropical Pacific radiocarbon variability during the last millennium: CORAL <sup>14</sup> C DURING THE LAST MILLENNIUM","Paleoceanography","","08838305","10.1029/2009PA001788","http://doi.wiley.com/10.1029/2009PA001788","","2010-12","2021-09-23 22:35:33","2021-09-23 22:35:33","2021-06-28 14:28:33","n/a-n/a","","4","25","","Paleoceanography","Coral records of central tropical Pacific radiocarbon variability during the last millennium","","","","","","","en","","","","","DOI.org (Crossref)","","Number: 4","","","","age calibration,; c-14,; circulation,; climate,; currents,; diagenesis,; sea,; surface ocean,; temperatures,; ventilation","","","","","","","","","","","","","","","","","","","","","","","","","","","","","","","","","","","","","","","","","","","","","","",""
"73CB8XCF","journalArticle","2011","Aeby, Greta S.; Williams, Gareth J.; Franklin, Erik C.; Haapkyla, Jessica; Harvell, C. Drew; Neale, Stephen; Page, Cathie A.; Raymundo, Laurie; Vargas-Ángel, Bernardo; Willis, Bette L.; Work, Thierry M.; Davy, Simon K.","Growth Anomalies on the Coral Genera Acropora and Porites Are Strongly Associated with Host Density and Human Population Size across the Indo-Pacific","PLoS ONE","","1932-6203","10.1371/journal.pone.0016887","https://dx.plos.org/10.1371/journal.pone.0016887","Growth anomalies (GAs) are common, tumor-like diseases that can cause significant morbidity and decreased fecundity in the major Indo-Pacific reef-building coral genera, Acropora and Porites. GAs are unusually tractable for testing hypotheses about drivers of coral disease because of their pan-Pacific distributions, relatively high occurrence, and unambiguous ease of identification. We modeled multiple disease-environment associations that may underlie the prevalence of Acropora growth anomalies (AGA) (n = 304 surveys) and Porites growth anomalies (PGA) (n = 602 surveys) from across the Indo-Pacific. Nine predictor variables were modeled, including coral host abundance, human population size, and sea surface temperature and ultra-violet radiation anomalies. Prevalence of both AGAs and PGAs were strongly host density-dependent. PGAs additionally showed strong positive associations with human population size. Although this association has been widely posited, this is one of the first broad-scale studies unambiguously linking a coral disease with human population size. These results emphasize that individual coral diseases can show relatively distinct patterns of association with environmental predictors, even in similar diseases (growth anomalies) found on different host genera (Acropora vs. Porites). As human densities and environmental degradation increase globally, the prevalence of coral diseases like PGAs could increase accordingly, halted only perhaps by declines in host density below thresholds required for disease establishment.","2011-02-18","2021-09-23 22:35:33","2021-09-23 22:35:33","2021-06-28 14:28:37","e16887","","2","6","","PLoS ONE","","","","","","","","en","","","","","DOI.org (Crossref)","","Number: 2","","","https://journals.plos.org/plosone/article/file?id=10.1371/journal.pone.0016887&type=printable","Animals,; Ecosystem,; Pacific Ocean,; Environment,; Population Density,; Animal Diseases/epidemiology,; Anthozoa/classification/growth & development,; Growth Disorders/epidemiology,; Human Activities/statistics & numerical data,; Humans,; Indian Ocean,; Prevalence","","Voolstra, Christian","","","","","","","","","","","","","","","","","","","","","","","","","","","","","","","","","","","","","","","","","","","","",""
"23CNCWAW","journalArticle","","Bauer, Aaron M; Hathaway, Stacie A; Fisher, Robert N","Polydactyly in the Central Pacific Gecko, Lepidodactylus sp. (Squamata: Gekkonidae)","","","","","","We report the first known case of naturally occurring polydactyly in a gekkotan lizard. A single individual from Palmyra Atoll exhibited a triplication of digit III of the manus, resulting in seven normally-formed and apparently functional digits on the right hand. No obvious teratogenic sources are present on the atoll and the causal factors of polydactyly in Lepidodactylus sp. remain unknown.","","2021-09-23 22:35:33","2021-09-23 22:35:33","","4","","","","","","","","","","","","","en","","","","","Zotero","","","","","","","","","","","","","","","","","","","","","","","","","","","","","","","","","","","","","","","","","","","","","","","","","","","","",""
"6IUZIWKH","journalArticle","2008","Baumann, Simone; Hildebrand, John A.; Wiggins, Sean M.; Schnitzler, Hans‐Ulrich","Species identification and measurement of activity in odontocete species of Palmyra Atoll by acoustic monitoring","The Journal of the Acoustical Society of America","","0001-4966","10.1121/1.2932958","http://asa.scitation.org/doi/10.1121/1.2932958","","2008-05","2021-09-23 22:35:34","2021-09-23 22:35:34","2021-06-28 14:28:40","3099-3099","","5","123","","The Journal of the Acoustical Society of America","","","","","","","","en","","","","","DOI.org (Crossref)","","Number: 5","","","","","","","","","","","","","","","","","","","","","","","","","","","","","","","","","","","","","","","","","","","","","","","","","","",""
"G4843IY3","journalArticle","2010","Baumann-Pickering, Simone; Wiggins, Sean M.; Roth, Ethan H.; Roch, Marie A.; Schnitzler, Hans-Ulrich; Hildebrand, John A.","Echolocation signals of a beaked whale at Palmyra Atoll","The Journal of the Acoustical Society of America","","0001-4966","10.1121/1.3409478","http://asa.scitation.org/doi/10.1121/1.3409478","","2010-06","2021-09-23 22:35:34","2021-09-23 22:35:34","2021-06-28 14:28:43","3790-3799","","6","127","","The Journal of the Acoustical Society of America","","","","","","","","en","","","","","DOI.org (Crossref)","","Number: 6","","","","Animals,; Hawaii,; Pacific Ocean,; Species Specificity,; Acoustics,; Animals, Wild,; Echolocation,; Sound Spectrography,; Time Factors,; Whales","","","","","","","","","","","","","","","","","","","","","","","","","","","","","","","","","","","","","","","","","","","","","","",""
"D7MJ89BV","journalArticle","2008","Bell, James J.; Carballo, José Luis","Patterns of sponge biodiversity and abundance across different biogeographic regions","Marine Biology","","0025-3162, 1432-1793","10.1007/s00227-008-1036-6","http://link.springer.com/10.1007/s00227-008-1036-6","","2008-11","2021-09-23 22:35:34","2021-09-23 22:35:34","2021-06-28 14:28:47","563-570","","6","155","","Mar Biol","","","","","","","","en","","","","","DOI.org (Crossref)","","Number: 6","","","","communities,; coral-reefs,; assemblages,; disturbance,; diversity gradients,; ecology; intertidal boulder-fields,; marine sponges,; porifera,; species-area relationship,","","","","","","","","","","","","","","","","","","","","","","","","","","","","","","","","","","","","","","","","","","","","","","",""
"SHDSUTKC","journalArticle","2017","Bradley, Darcy; Conklin, Eric; Papastamatiou, Yannis P.; McCauley, Douglas J.; Pollock, Kydd; Kendall, Bruce E.; Gaines, Steven D.; Caselle, Jennifer E.","Growth and life history variability of the grey reef shark (Carcharhinus amblyrhynchos) across its range","PLOS ONE","","1932-6203","10.1371/journal.pone.0172370","https://dx.plos.org/10.1371/journal.pone.0172370","","2017-02-16","2021-09-23 22:35:34","2021-09-23 22:35:34","2021-06-28 14:28:50","e0172370","","2","12","","PLoS ONE","","","","","","","","en","","","","","DOI.org (Crossref)","","Number: 2","","","","Animals,; Ecosystem,; Conservation of Natural Resources,; Female,; Male,; Population Density,; Sharks/growth & development; Life Cycle Stages/physiology,","","Patterson, Heather M.","","","","","","","","","","","","","","","","","","","","","","","","","","","","","","","","","","","","","","","","","","","","",""
"WK3D4F8U","journalArticle","","Braun, C L; Smith, J E; Vroom, P S","Examination of Algal Diversity and Benthic Community Structure at Palmyra Atoll, U.S. Line Islands","","","","","","Palmyra Atoll National Wildlife Refuge is the second largest atoll under U.S. jurisdiction in the Pacific Ocean. Until recently, little was known about benthic communities and, more specifically, algal abundance at Palmyra aside from species lists generated during 1916, 1955 and 1959 expeditions. Since 2000, NOAA’s Pacific Islands Fisheries Science Center, Coral Reef Ecosystem Division has conducted six rapid ecological assessment surveys to monitor and gather baseline data for reefs surrounding Palmyra. Additionally, Scripps Institute of Oceanography documented benthic community structure on Palmyra’s reefs during a 2005 expedition. This study reports on the current state of knowledge for benthic community composition and algal community structure across the atoll. Benthic communities in fore reef areas (10 m depth) were dominated by reef builders (coral and crustose coralline algae) covering ~50% of the benthos, while turf algae, macroalgae, soft corals, and other invertebrates covered the remaining surfaces. Species of Halimeda, Lobophora, Dictyosphaeria, Galaxaura and Dichotomaria were among the 5 most common macroalgae recorded. Overall, the reef communities around Palmyra appear relatively healthy. Developing comprehensive species lists and continuing benthic monitoring will allow reef managers to detect ecosystem changes, including possible introduced and invasive species.","","2021-09-23 22:35:34","2021-09-23 22:35:34","","6","","","","","","","","","","","","","en","","","","","Zotero","","","","","","","","","","","","","","","","","","","","","","","","","","","","","","","","","","","","","","","","","","","","","","","","","","","","",""
"6FUX3PEG","journalArticle","2012","Briggs, Amy A.; Young, Hillary S.; McCauley, Douglas J.; Hathaway, Stacie A.; Dirzo, Rodolfo; Fisher, Robert N.","Effects of Spatial Subsidies and Habitat Structure on the Foraging Ecology and Size of Geckos","PLoS ONE","","1932-6203","10.1371/journal.pone.0041364","https://dx.plos.org/10.1371/journal.pone.0041364","While it is well established that ecosystem subsidies—the addition of energy, nutrients, or materials across ecosystem boundaries—can affect consumer abundance, there is less information available on how subsidy levels may affect consumer diet, body condition, trophic position, and resource partitioning among consumer species. There is also little information on whether changes in vegetation structure commonly associated with spatial variation in subsidies may play an important role in driving consumer responses to subsidies. To address these knowledge gaps, we studied changes in abundance, diet, trophic position, size, and body condition of two congeneric gecko species (Lepidodactylus spp.) that coexist in palm dominated and native (hereafter dicot dominated) forests across the Central Pacific. These forests differ strongly both in the amount of marine subsidies that they receive from seabird guano and carcasses, and in the physical structure of the habitat. Contrary to other studies, we found that subsidy level had no impact on the abundance of either gecko species; it also did not have any apparent effects on resource partitioning between species. However, it did affect body size, dietary composition, and trophic position of both species. Geckos in subsidized, dicot forests were larger, had higher body condition and more diverse diets, and occupied a much higher trophic position than geckos found in palm dominated, low subsidy level forests. Both direct variation in subsidy levels and associated changes in habitat structure appear to play a role in driving these responses. These results suggest that variation in subsidy levels may drive important behavioral responses in predators, even when their numerical response is limited. Strong changes in trophic position of consumers also suggest that subsidies may drive increasingly complex food webs, with longer overall food chain length.","2012-08-10","2021-09-23 22:35:34","2021-09-23 22:35:34","2021-06-28 14:29:01","e41364","","8","7","","PLoS ONE","","","","","","","","en","","","","","DOI.org (Crossref)","","Number: 8","","","","Animals,; Ecosystem,; Food Chain,; Female,; Male,; Body Size,; Lizards,; Population Dynamics,; Soil,; Trees","","Dornhaus, Anna","","","","","","","","","","","","","","","","","","","","","","","","","","","","","","","","","","","","","","","","","","","","",""
"2FZ6IFUE","journalArticle","2009","Brownell Jr., Robert L.; Ralls, Katherine; Baumann-Pickering, Simone; Poole, M. Michael","Behavior of melon-headed whales, <i>Peponocephala electra</i> , near oceanic islands","Marine Mammal Science","","08240469, 17487692","10.1111/j.1748-7692.2009.00281.x","http://doi.wiley.com/10.1111/j.1748-7692.2009.00281.x","","2009-07","2021-09-23 22:35:34","2021-09-23 22:35:34","2021-06-28 14:29:03","639-658","","3","25","","","","","","","","","","en","","","","","DOI.org (Crossref)","","Number: 3","","","","behavior,; Hanalei Bay,; Hatihue Bay,; lunar cycles,; mass-stranding,; melon-headed whales,; midfrequency sonar,; Peponocephala electra,; Sasanhaya Bay","","","","","","","","","","","","","","","","","","","","","","","","","","","","","","","","","","","","","","","","","","","","","","",""
"E8YLLNU8","journalArticle","2013","Carballo, José Luis; Aguilar-Camacho, Jose María; Knapp, Ingrid S.; Bell, James J.","Wide distributional range of marine sponges along the Pacific Ocean","Marine Biology Research","","1745-1000, 1745-1019","10.1080/17451000.2013.765581","http://www.tandfonline.com/doi/abs/10.1080/17451000.2013.765581","Widespread geographic distribution of sponges should be rare, mainly because of the low dispersal capacity of their larvae and asexual products. Here we investigate the potential wide-scale distribution range in one marine sponge, Gelliodes wilsoni, that has been spread widely around the Pacific Rim by shipping. The species was originally described from the Philippines (western Pacific Ocean) by Wilson in 1925 as Gelliodes fibrosa. Recently, similar specimens have been collected from Guam (western Pacific Ocean), Hawaii, Palmyra Atoll (central Pacific Ocean), Acapulco Bay and Baja Peninsula (eastern Pacific Ocean). This species now appears to be widely distributed across the Pacific Ocean, and this distribution seems unlikely to have resulted from an extremely high dispersal capability; it is most likely the result of centuries of trans-Pacific shipping. We also propose the new name G. wilsoni for the species G. fibrosa originally described by Wilson because the same name was previously used by Dendy in 1905 to describe a species from Sri Lanka, which is morphologically different from the species described by Wilson. The case of G. wilsoni is not unique because several sponges (discussed here) have similar distribution patterns across the Pacific (at locations more than 10,000 km apart). This suggests an eastÁwest connectivity and that widespread distribution in sponges is indeed possible, albeit the result of human activities. In an increasingly connected world our research highlights the importance of understanding connectivity across oceanic scales in order to predict where invasive species are likely to occur.","2013-10","2021-09-23 22:35:34","2021-09-23 22:35:34","2021-06-28 14:29:09","768-775","","8","9","","Marine Biology Research","","","","","","","","en","","","","","DOI.org (Crossref)","","Number: 8","","","","coral-reefs,; hawaiian-islands,; porifera,; anthropogenic biogeography,; climate-change,; demospongiae,; human dispersal,; impact,; north-east atlantic,; oahu; pacific ocean,; records,; sponges,; transport,; widespread distribution,","","","","","","","","","","","","","","","","","","","","","","","","","","","","","","","","","","","","","","","","","","","","","","",""
"2F7VAV77","journalArticle","2017","Carlson, Pm; Davis, K; Warner, Rr; Caselle, Je","Fine-scale spatial patterns of parrotfish herbivory are shaped by resource availability","Marine Ecology Progress Series","","0171-8630, 1616-1599","10.3354/meps12258","https://www.int-res.com/abstracts/meps/v577/p165-176/","Herbivory by fishes and sea urchins is a powerful mechanism on coral reefs that mitigates coral−algal competition by physically removing algae and creating bare space. Spatially constrained grazing by herbivores, particularly parrotfishes, may foster coral recruitment by creating a spatially continuous refuge of bare substrate for settlement and survival. However, frequent bouts of concentrated feeding potentially remove newly settled corals. Understanding the frequency and intensity of parrotfish foraging behavior at appropriate scales (months and meters) is essential for connecting herbivory with benthic processes. We documented the foraging behavior of a large, mobile coral reef herbivore (the steephead parrotfish Chlorurus microrhinos) on Palmyra Atoll using various techniques (observational follows, fish surveys, and bite scar tracking) across 2 habitat states (one dominated by algal turfs, one dominated by live coral and crustose coralline algae) that are representative of reefs throughout the Central Pacific. Large differences in the abundance of a preferred resource were associated with major differences in feeding behavior. Where resources were abundant and regrew quickly, foraging areas were small and spatially focused, resulting in dense patches of bite scars (>100 bites m−2). Feeding behavior also showed a temporal periodicity, with individuals defending and regrazing the same area after regrowth occurred. In areas where resources were less abundant and recovered more slowly, parrotfish movements and foraging areas were significantly larger and bites were distributed sparsely across food patches. The large variability we observed within a single atoll suggests that characterizing species-specific foraging patterns from small-scale studies may not be appropriate.","2017-08-18","2021-09-23 22:35:34","2021-09-23 22:35:34","2021-06-28 14:29:12","165-176","","","577","","Mar. Ecol. Prog. Ser.","","","","","","","","en","","","","","DOI.org (Crossref)","","","","","","mortality,; coral-reefs,; competition,; coral reefs,; dynamics,; palmyra atoll,; abundance; bite scar,; chlorurus microrhinos,; chlorurus-microrhinos,; coral-algal interactions,; herbivory,; parrotfish,; predation,; settlement,; steephead parrotfish,; trophic cascades,; turf algae,","","","","","","","","","","","","","","","","","","","","","","","","","","","","","","","","","","","","","","","","","","","","","","",""
"AIUQIJ2Q","journalArticle","2019","Carter, Amanda L.; Edwards, Clinton B.; Fox, Michael D.; Amir, Corinne G.; Eynaud, Yoan; Johnson, Maggie D.; Lewis, Levi S.; Sandin, Stuart A.; Smith, Jennifer E.","Changes in benthic community composition associated with the outbreak of the corallimorph, Rhodactis howesii, at Palmyra Atoll","Coral Reefs","","0722-4028, 1432-0975","10.1007/s00338-019-01841-5","http://link.springer.com/10.1007/s00338-019-01841-5","","2019-12","2021-09-23 22:35:34","2021-09-23 22:35:34","2021-06-28 14:29:15","1267-1279","","6","38","","Coral Reefs","","","","","","","","en","","","","","DOI.org (Crossref)","","Number: 6","","","","Coral reef,; Disturbance,; Invasion biology,; Large-area imaging; Long-term monitoring,","","","","","","","","","","","","","","","","","","","","","","","","","","","","","","","","","","","","","","","","","","","","","","",""
"MDG5UE8S","journalArticle","","Clark, Oscar","THE RECENT CARBONATE SEDIMENTS OF PALMYRA ATOLL, NORTHERN LINE ISLANDS, CENTRAL PACIFIC OCEAN","","","","","http://hdl.handle.net/10063/1001","Palmyra Atoll is an isolated carbonate reef system located approximately 1600 km south of Hawaii in the northern Line Islands, central Pacific Ocean. Sediment samples from the lagoons and tidal zones were analyzed for grainsize and composition, and the results used to compile detailed maps and interpret the environments and lithofacies present. A distinct grainsize distribution was observed forming concentric bands ranging from coarse gravel rubble on the outer reef through to finer material in the interior of the atoll in the deep lagoons, where peloidal muds prevail. Five lithologic facies have been identified and typical sediments are poorly sorted and near-symmetrical in their grainsize distribution. On average, sediments are medium sand. A distinct chlorozoan assemblage was observed with coral and calcareous red algal fragments forming half of the sediment, with varying amounts of molluscs, Halimeda and foraminifera being the lesser major constituents. Lagoonal and tidal sediments showed little variation in composition between locations and lacked clear compositional zonation, characteristic of other larger atolls of the Pacific. Palmyra Atoll is unique in that it has had little human intervention for the last sixty years and as a result uninhibited natural processes are occurring. It is also unique in that it displays relatively deep for its size (<55 m), steep-sided compartmentalized lagoons that have abundant fine material (upward of 70% silt or finer), a feature not commonly observed at other Pacific atolls. This fine material has been identified as a peloidal mud and its mode and rate of deposition may be partly controlled by the abundant zooplankton in the lagoons. Recent sediments of Palmyra Atoll are almost entirely carbonate, originating from reef organisms inhabiting the atoll. The only other material is small amounts of siliceous sponge skeletons.","","2021-09-23 22:35:34","2021-09-23 22:35:34","","152","","","","","","","","","","","","","en","","","","","Zotero","","","","","","","","","","","","","","","","","","","","","","","","","","","","","","","","","","","","","","","","","","","","","","","","","","","","",""
