"NSW4V23V","journalArticle","2015","Rogers, Justin S.; Monismith, Stephen G.; Dunbar, Robert B.; Koweek, David","Field observations of wave-driven circulation over spur and groove formations on a coral reef","Journal of Geophysical Research: Oceans","","21699275","10.1002/2014JC010464","http://doi.wiley.com/10.1002/2014JC010464","Spur and groove (SAG) formations are found on the forereefs of many coral reefs worldwide. Modeling results have shown that SAG formations together with shoaling waves induce a nearshore Lagrangian circulation pattern of counter-rotating circulation cells, but these have never been observed in the ﬁeld. We present results from two separate ﬁeld studies of SAG formations on Palmyra Atoll which show their effect on waves to be small, but reveal a persistent order 1 cm/s depth-averaged Lagrangian offshore ﬂow over the spur and onshore ﬂow over the grooves. This circulation was stronger for larger, directly incident waves and low alongshore ﬂow conditions, consistent with predictions from modeling. Favorable forcing conditions must be maintained on the order of 1 h to accelerate and develop the SAG circulation cells. The primary cross and alongshore depth-averaged momentum balances were between the pressure gradient, radiation stress gradient, and nonlinear convective terms, and the bottom drag was similar to values found on other reefs. The vertical structure of these circulation cells was previously unknown and the results show a complex horizontal offshore Lagrangian ﬂow over the spurs near the surface driven by alongshore variability in radiation stress gradients. Vertical ﬂow was downward over the spur and upward over the groove, likely driven by alongshore differences in bottom stress and not by vortex forcing.","2015-01","2021-09-23 22:35:36","2021-09-23 22:35:36","2021-06-28 14:33:15","145-160","","1","120","","J. Geophys. Res. Oceans","","","","","","","","en","","","","","DOI.org (Crossref)","","Number: 1","","","","coral reef,; Palmyra Atoll; hydrodynamics,; spur and groove,; wave‐current interaction,","","","","","","","","","","","","","","","","","","","","","","","","","","","","","","","","","","","","","","","","","","","","","","",""
"7SCF42BL","journalArticle","2016","Rogers, Justin S.; Monismith, Stephen G.; Koweek, David A.; Torres, Walter I.; Dunbar, Robert B.","Thermodynamics and hydrodynamics in an atoll reef system and their influence on coral cover: Atoll Thermal & Hydro-Dynamics & Coral Effects","Limnology and Oceanography","","00243590","10.1002/lno.10365","http://doi.wiley.com/10.1002/lno.10365","We present results of the thermodynamics and hydrodynamics of an atoll system and their effect on coral cover based on ﬁeld measurements from 2012 to 2014 on Palmyra Atoll in the central Paciﬁc. We found that spatial variations in coral cover were correlated with temperature variations on time scales of days to weeks. Shallow terrace and backreef sites with high coral cover (> 50%) had a highly variable temperature distributions, but their average weekly temperature distributions were lower and similar to offshore waters. The mechanism for maintaining this low weekly temperature was mean advection, which varied on a weekly timescale in response to wave forcing. Tides were also important in driving ﬂow on the atoll, but their contribution to the net transport of heat was not signiﬁcant. Wind and regional forcing were generally not important in driving ﬂow inside the atoll. Buoyancy-driven ﬂows were important within the lagoons, and in driving cross-shore exchange on forereef environments. The physical factors favoring high coral cover percentage varied according to the different prevailing hydrodynamic regimes: low temperatures in backreef habitats, short travel times in lagoon habitats (days since entering the reef system), and lower wave stress on forereef habitats. In light of future warming from climate change, local areas of reefs which maintain lower temperatures through wave-driven mean ﬂows will have the best likelihood of promoting coral survival.","2016-11","2021-09-23 22:35:36","2021-09-23 22:35:36","2021-06-28 14:33:21","2191-2206","","6","61","","Limnol. Oceanogr.","Thermodynamics and hydrodynamics in an atoll reef system and their influence on coral cover","","","","","","","en","","","","","DOI.org (Crossref)","","Number: 6","","","","palmyra atoll,; island,; climate-change,; water; ocean,; lagoon,; pacific atoll,; residence time,; sediment transport,; wave-driven circulation,","","","","","","","","","","","","","","","","","","","","","","","","","","","","","","","","","","","","","","","","","","","","","","",""
"8FCV3864","journalArticle","2017","Rogers, Justin S.; Monismith, Stephen G.; Fringer, Oliver B.; Koweek, David A.; Dunbar, Robert B.","A coupled wave-hydrodynamic model of an atoll with high friction: Mechanisms for flow, connectivity, and ecological implications","Ocean Modelling","","14635003","10.1016/j.ocemod.2016.12.012","https://linkinghub.elsevier.com/retrieve/pii/S146350031630169X","","2017-02","2021-09-23 22:35:36","2021-09-23 22:35:36","2021-06-28 14:33:25","66-82","","","110","","Ocean Modelling","A coupled wave-hydrodynamic model of an atoll with high friction","","","","","","","en","","","","","DOI.org (Crossref)","","","","","https://www.sciencedirect.com/science/article/pii/S146350031630169X?via%3Dihub","coral reefs,; climate-change,; coral-reef,; hydrodynamics,; pacific atoll,; residence time,; sediment transport,; driven circulation,; french-polynesia,; lagoon; numerical-model,; surface water waves,; temperature, atolls,; tuamotu archipelago,","","","","","","","","","","","","","","","","","","","","","","","","","","","","","","","","","","","","","","","","","","","","","","",""
"8I5JWLJB","journalArticle","2009","Roth, Ms; Knowlton, N","Distribution, abundance, and microhabitat characterization of small juvenile corals at Palmyra Atoll","Marine Ecology Progress Series","","0171-8630, 1616-1599","10.3354/meps07787","http://www.int-res.com/abstracts/meps/v376/p133-142/","Juvenile corals are an important component of the population dynamics of corals, but little is known about the ecology and natural history of their early life-history stages. In demographic surveys, small juvenile corals are often grouped with larger and older corals or overlooked entirely due to their small size and cryptic nature. This study describes the distribution, abundance, and microhabitat of small juvenile corals, defined as post-settlement corals ≤5 mm in diameter, at Palmyra Atoll, Central Pacific. A diver-operated pulsating blue light and filter system was used to enhance innate coral fluorescence during daylight to aid in detecting small juvenile corals. Juvenile densities ranged from 0 to 59.5 m–2 and were more than 9 times higher on the fore reef (21.9 ± 0.8 m–2) than on the back reef (2.4 ± 0.3 m–2). The highest juvenile densities were observed in the middle of the sampled range at 14 m depth on the fore reef. Juvenile corals accounted for > 31% of coral colonies in all habitats and depths, which resulted in positively skewed size-frequency distributions. The microhabitat of juvenile corals on coral rubble was best described as a convex surface covered with crustose coralline algae that lacked another coral within a 20 mm radius. This study provides basic ecology and natural history information of small juvenile corals and shows the feasibility of surveying corals ≤5 mm in diameter as a method for monitoring coral populations and assessing environmental changes on a coral reef.","2009-02-11","2021-09-23 22:35:36","2021-09-23 22:35:36","2021-06-28 14:33:28","133-142","","","376","","Mar. Ecol. Prog. Ser.","","","","","","","","en","","","","","DOI.org (Crossref)","","","","","","competition,; abundance,; ecology,; palmyra atoll,; fluorescence census techniques,; reefs,; distribution,; florida; juvenile corals,; life-histories,; long-term decline,; microhabitat,; population-structure,; postsettlement mortality,; recruit,; recruitment patterns,; scleractinian corals,","","","","","","","","","","","","","","","","","","","","","","","","","","","","","","","","","","","","","","","","","","","","","","",""
"NM2Z4AV7","journalArticle","2008","Sandin, Stuart A.; Smith, Jennifer E.; DeMartini, Edward E.; Dinsdale, Elizabeth A.; Donner, Simon D.; Friedlander, Alan M.; Konotchick, Talina; Malay, Machel; Maragos, James E.; Obura, David; Pantos, Olga; Paulay, Gustav; Richie, Morgan; Rohwer, Forest; Schroeder, Robert E.; Walsh, Sheila; Jackson, Jeremy B. C.; Knowlton, Nancy; Sala, Enric","Baselines and Degradation of Coral Reefs in the Northern Line Islands","PLoS ONE","","1932-6203","10.1371/journal.pone.0001548","https://dx.plos.org/10.1371/journal.pone.0001548","Effective conservation requires rigorous baselines of pristine conditions to assess the impacts of human activities and to evaluate the efficacy of management. Most coral reefs are moderately to severely degraded by local human activities such as fishing and pollution as well as global change, hence it is difficult to separate local from global effects. To this end, we surveyed coral reefs on uninhabited atolls in the northern Line Islands to provide a baseline of reef community structure, and on increasingly populated atolls to document changes associated with human activities. We found that top predators and reef-building organisms dominated unpopulated Kingman and Palmyra, while small planktivorous fishes and fleshy algae dominated the populated atolls of Tabuaeran and Kiritimati. Sharks and other top predators overwhelmed the fish assemblages on Kingman and Palmyra so that the biomass pyramid was inverted (top-heavy). In contrast, the biomass pyramid at Tabuaeran and Kiritimati exhibited the typical bottom-heavy pattern. Reefs without people exhibited less coral disease and greater coral recruitment relative to more inhabited reefs. Thus, protection from overfishing and pollution appears to increase the resilience of reef ecosystems to the effects of global warming.","2008-02-27","2021-09-23 22:35:36","2021-09-23 22:35:36","2021-06-28 14:33:31","e1548","","2","3","","PLoS ONE","","","","","","","","en","","","","","DOI.org (Crossref)","","Number: 2","","","","Animals,; Ecosystem,; Geography,; Fishes,; Conservation of Natural Resources,; Biomass,; Anthozoa,; Greenhouse Effect,; Eukaryota,; Water Pollutants","","Ahmed, Niyaz","","","","","","","","","","","","","","","","","","","","","","","","","","","","","","","","","","","","","","","","","","","","",""
"72XKD5KW","journalArticle","2011","Sayani, Hussein R.; Cobb, Kim M.; Cohen, Anne L.; Elliott, W. Crawford; Nurhati, Intan S.; Dunbar, Robert B.; Rose, Kathryn A.; Zaunbrecher, Laura K.","Effects of diagenesis on paleoclimate reconstructions from modern and young fossil corals","Geochimica et Cosmochimica Acta","","00167037","10.1016/j.gca.2011.08.026","https://linkinghub.elsevier.com/retrieve/pii/S0016703711004820","The integrity of coral-based reconstructions of past climate variability depends on a comprehensive knowledge of the eﬀects of post-depositional alteration on coral skeletal geochemistry. Here we combine millimeter-scale and micro-scale coral Sr/Ca data, scanning electron microscopy (SEM) images, and X-ray diﬀraction with previously published d18O records to investigate the eﬀects of submarine and subaerial diagenesis on paleoclimate reconstructions in modern and young sub-fossil corals from the central tropical Paciﬁc. In a 40-year-old modern coral, we ﬁnd secondary aragonite is associated with relatively high coral d18O and Sr/Ca, equivalent to sea-surface temperature (SST) artifacts as large as À3 and À5 °C, respectively. Secondary aragonite observed in a 350-year-old fossil coral is associated with relatively high d18O and Sr/Ca, resulting in apparent paleo-SST oﬀsets of up to À2 and À4 °C, respectively. Secondary Ion Mass Spectrometry (SIMS) analyses of secondary aragonite yield Sr/Ca ratios ranging from 10.78 to 12.39 mmol/mol, signiﬁcantly higher compared to 9.15 ± 0.37 mmol/mol measured in more pristine sections of the same fossil coral. Widespread dissolution and secondary calcite observed in a 750-year-old fossil coral is associated with relatively low d18O and Sr/Ca. SIMS Sr/Ca measurements of the secondary calcite (1.96–9.74 mmol/mol) are signiﬁcantly lower and more variable than Sr/Ca values from more pristine portions of the same fossil coral (8.22 ± 0.13 mmol/mol). Our results indicate that while diagenesis has a much larger impact on Sr/Ca-based paleoclimate reconstructions than d18O-based reconstructions at our site, SIMS analyses of relatively pristine skeletal elements in an altered coral may provide robust estimates of Sr/Ca which can be used to derive paleo-SSTs.","2011-11","2021-09-23 22:35:36","2021-09-23 22:35:36","2021-06-28 14:33:34","6361-6373","","21","75","","Geochimica et Cosmochimica Acta","","","","","","","","en","","","","","DOI.org (Crossref)","","Number: 21","","","","pacific,; el-nino,; climate variability,; new-caledonia,; sea-surface temperature,; porites corals,; precipitation; southern-oscillation,; sr/ca,; trace-elements,","","","","","","","","","","","","","","","","","","","","","","","","","","","","","","","","","","","","","","","","","","","","","","",""
"B4M5WRTJ","journalArticle","2006","Smith, Jennifer E.; Shaw, Morrigan; Edwards, Rob A.; Obura, David; Pantos, Olga; Sala, Enric; Sandin, Stuart A.; Smriga, Steven; Hatay, Mark; Rohwer, Forest L.","Indirect effects of algae on coral: algae-mediated, microbe-induced coral mortality","Ecology Letters","","1461-023X, 1461-0248","10.1111/j.1461-0248.2006.00937.x","http://doi.wiley.com/10.1111/j.1461-0248.2006.00937.x","Declines in coral cover are generally associated with increases in the abundance of ﬂeshy algae. In many cases, it remains unclear whether algae are responsible, directly or indirectly, for coral death or whether they simply settle on dead coral surfaces. Here, we show that algae can indirectly cause coral mortality by enhancing microbial activity via the release of dissolved compounds. When coral and algae were placed in chambers together but separated by a 0.02 lm filter, corals suffered 100% mortality. With the addition of the broad-spectrum antibiotic ampicillin, mortality was completely prevented. Physiological measurements showed complementary patterns of increasing coral stress with proximity to algae. Our results suggest that as human impacts increase and algae become more abundant on reefs a positive feedback loop may be created whereby compounds released by algae enhance microbial activity on live coral surfaces causing mortality of corals and further algal growth.","2006-07","2021-09-23 22:35:36","2021-09-23 22:35:36","2021-06-28 14:33:37","835-845","","7","9","","Ecol Letters","Indirect effects of algae on coral","","","","","","","en","","","","","DOI.org (Crossref)","","Number: 7","","","","Animals,; Ecosystem,; Anthozoa/microbiology,; Eukaryota,; Bacteria/chemistry,; Mortality,; Population Dynamics","","","","","","","","","","","","","","","","","","","","","","","","","","","","","","","","","","","","","","","","","","","","","","",""
"IFNWJ396","journalArticle","2010","Smriga, Steven; Sandin, Stuart A.; Azam, Farooq","Abundance, diversity, and activity of microbial assemblages associated with coral reef fish guts and feces: Microbial assemblages associated with coral reef fish guts","FEMS Microbiology Ecology","","01686496, 15746941","10.1111/j.1574-6941.2010.00879.x","https://academic.oup.com/femsec/article-lookup/doi/10.1111/j.1574-6941.2010.00879.x","Feces and distal gut contents were collected from three coral reef ﬁsh species. Bacteria cell abundances, as determined via epiﬂuorescence microscopy, ranged two orders of magnitude among the ﬁshes. Mass-speciﬁc and apparent cell-speciﬁc hydrolytic enzyme activities in feces from Chlorurus sordidus were very high, suggesting that endogenous ﬁsh enzymes were egested into feces. Denaturing gradient gel electrophoresis proﬁles of 16S rRNA genes were more similar among multiple individuals of the surgeonﬁsh Acanthurus nigricans than among individuals of the parrotﬁsh C. sordidus or the snapper Lutjanus bohar. Analyses of fecesderived 16S rRNA gene clones revealed that at least ﬁve bacterial phyla were present in A. nigricans and that Vibrionaceae comprised 10% of the clones. Meanwhile, C. sordidus contained at least ﬁve phyla and L. bohar three, but Vibrionaceae comprised 71% and 76% of the clones, respectively. Many sequences clustered phylogenetically to cultured Vibrio spp. and Photobacterium spp. including Vibrio ponticus and Photobacterium damselae. Other Vibrionaceae-like sequences comprised a distinct phylogenetic group that may represent the presence of ‘feces-speciﬁc’ bacteria. The observed differences among ﬁshes may reﬂect native gut microbiota and/or bacterial assemblages associated with ingested prey.","2010-03-30","2021-09-23 22:35:36","2021-09-23 22:35:36","2021-06-28 14:33:40","no-no","","","","","","Abundance, diversity, and activity of microbial assemblages associated with coral reef fish guts and feces","","","","","","","en","","","","","DOI.org (Crossref)","","","","","","Animals,; Biodiversity,; Water Microbiology; Anthozoa,; Phylogeny,; Bacteria/classification/genetics,; DNA, Bacterial/genetics,; Feces/microbiology,; Gene Library,; Likelihood Functions,; Perciformes/microbiology,; RNA, Ribosomal, 16S/genetics,; Sequence Analysis, DNA,","","","","","","","","","","","","","","","","","","","","","","","","","","","","","","","","","","","","","","","","","","","","","","",""
"DYRFWG6L","journalArticle","2013","Sterling, Eleanor J.; McFadden, Katherine W.; Holmes, Katherine E.; Vintinner, Erin C.; Arengo, Felicity; Naro-Maciel, Eugenia","Ecology and Conservation of Marine Turtles in a Central Pacific Foraging Ground","Chelonian Conservation and Biology","","1071-8443, 1943-3956","10.2744/CCB-1014.1","http://www.bioone.org/doi/abs/10.2744/CCB-1014.1","Foraging grounds are critical to the survival of marine turtles, yet studies of these areas lag behind those of nesting sites. Our study represents the first data and discussion on marine turtle distribution, abundance, and health at a marine turtle foraging ground in the central Pacific, Palmyra Atoll National Wildlife Refuge, which constitutes a regionally important mixed-size-class foraging ground for green turtles (Chelonia mydas) and, to a lesser extent, for hawksbill turtles (Eretmochelys imbricata). Surveys and anecdotal reports suggest that nesting activity is rare, and we have confirmed the presence of limited suitable nesting habitat. During inwater activities from 2008 to 2011, we caught 211 green turtles ranging from postpelagic juveniles to adults (weight: mean = 44.6 kg, range = 7.2–146.3 kg; curved carapace length (CCL): mean = 69.7 cm, range = 41.0–113.6 cm) and 2 juvenile hawksbills (weight2009 = 16.3 kg, CCL2009 = 57.0; weight2011 = 11.2 kg, CCL2011 = 50.5 cm). Body condition indices did not significantly differ by year of capture. These indices, along with the absence of observed fibropapilloma tumors, indicated that turtles at Palmyra Atoll were on average in very good condition. We also conducted 11 relative abundance surveys from 2005 to 2011, a subset of which revealed an uneven distribution of turtles around Palmyra Atoll with 3 hot spots of turtle abundance off the flats to the north, south, and east. By linking several aspects of our research program with similar efforts at foraging grounds throughout the Pacific Basin, we can further our understanding of poorly known regional migratory connectivity.","2013-07","2021-09-23 22:35:36","2021-09-23 22:35:36","2021-06-28 14:33:44","2-16","","1","12","","Chelonian Conservation and Biology","","","","","","","","en","","","","","DOI.org (Crossref)","","Number: 1","","","","coral-reefs,; hawaiian-islands,; northern line islands,; palmyra atoll,; baja-california,; body condition,; chelonia mydas,; chelonia-mydas,; conservation threats,; eastern pacific green turtle,; eretmochelys imbricata,; fibropapillomatosis,; foraging,; green sea-turtles,; hawksbill turtle,; herpes virus,; mexico,; population; relative abundance,; reptilia,; testudines,","","","","","","","","","","","","","","","","","","","","","","","","","","","","","","","","","","","","","","","","","","","","","","",""
"PUBL6VWV","journalArticle","2007","Stevenson, Charlotte; Katz, Laure S.; Micheli, Fiorenza; Block, Barbara; Heiman, Kimberly W.; Perle, Chris; Weng, Kevin; Dunbar, Robert; Witting, Jan","High apex predator biomass on remote Pacific islands","Coral Reefs","","0722-4028, 1432-0975","10.1007/s00338-006-0158-x","http://link.springer.com/10.1007/s00338-006-0158-x","On coral reefs in Palmyra—a central PaciWc atoll with limited Wshing pressure—total Wsh biomass was 428 and 299% greater than on reefs in nearby Christmas and Fanning Islands. Large apex predators, groupers, sharks, snappers, and jacks larger than 50 cm in length, accounted for 56% of total Wsh biomass in Palmyra on average, but only 7 and 3% on Christmas and Fanning. These biomass proportions are remarkably similar to those previously reported for the remote and uninhabited Northwest Hawaiian Islands (NWHI) and densely populated Main Hawaiian Islands (MHI), although Palmyra’s reefs are dominated in biomass by sharks (44% of the total), whereas the NWHI by jacks (39%). Herbivorous Wsh biomass was also greater on Palmyra than on Christmas and Fanning (343 and 207%, respectively). These results and previous Wndings indicate that remote, uninhabited islands support high levels of consumers, and highlight the importance of healthy coral reef ecosystems as reference points for assessment of human impacts and establishment of restoration goals.","2007-03-06","2021-09-23 22:35:36","2021-09-23 22:35:36","2021-06-28 14:33:50","47-51","","1","26","","Coral Reefs","","","","","","","","en","","","","","DOI.org (Crossref)","","Number: 1","","","","coral reefs,; ecosystems,; palmyra,; depletion; fish communities,; fishing impacts,; food webs,; line islands,; top predators,","","","","","","","","","","","","","","","","","","","","","","","","","","","","","","","","","","","","","","","","","","","","","","",""
"XVCUF67L","journalArticle","2018","Struckhoff, Matthew A.; Orazio, Carl E.; Tillitt, Donald E.; Shaver, David K.; Papoulias, Diana M.","Mapping elemental contamination on Palmyra Atoll National Wildlife Refuge","Marine Pollution Bulletin","","0025326X","10.1016/j.marpolbul.2017.12.065","https://linkinghub.elsevier.com/retrieve/pii/S0025326X17311013","Palmyra Atoll, once a WWII U.S. Navy air station, is now a U.S. National Wildlife Refuge with nearly 50 km2 of coral reef and 275 ha of emergent lands with forests of Pisonia grandis trees and colonies of several bird species. Due to the known elemental and organic contamination from chemicals associated with aviation, power generation and transmission, waste management, and other air station activities, a screening survey to map elemental concentrations was conducted. A map of 1944 Navy facilities was georeferenced and identiﬁable features were digitized. These data informed a targeted survey of 25 elements in soils and sediment at locations known or suspected to be contaminated, using a hand-held X-ray ﬂuorescence spectrometer. At dozens of locations, concentrations of elements exceeded established soil and marine sediment thresholds for adverse ecological eﬀects. Results were compiled into a publically available geospatial dataset to inform potential remediation and habitat restoration activities.","2018-03","2021-09-23 22:35:37","2021-09-23 22:35:37","2021-06-28 14:33:54","97-105","","","128","","Marine Pollution Bulletin","","","","","","","","en","","","","","DOI.org (Crossref)","","","","","","Animals,; Ecosystem,; Pacific Islands,; Geologic Sediments/chemistry,; Coral Reefs,; Pacific Ocean,; Palmyra Atoll,; Animals, Wild,; Line Islands,; Conservation of Natural Resources/methods,; Elemental contaminants,; Environmental Monitoring/instrumentation/methods,; Environmental Pollutants/analysis,; Geographic Information Systems,; Geospatial data,; Hand-held X-ray fluorescence spectrometry,; Satellite Imagery,; Soil/chemistry,; Spectrometry, X-Ray Emission,; Trace Elements/analysis,; United States,; WWII Pacific bases","","","","","","","","","","","","","","","","","","","","","","","","","","","","","","","","","","","","","","","","","","","","","","",""
