"WLC5LR5I","journalArticle","2010","Houlbrèque, Fanny; McCulloch, Malcolm; Roark, Brendan; Guilderson, Tom; Meibom, Anders; Kimball, Justine; Mortimer, Graham; Cuif, Jean-Pierre; Dunbar, Robert","Uranium-series dating and growth characteristics of the deep-sea scleractinian coral: Enallopsammia rostrata from the Equatorial Pacific","Geochimica et Cosmochimica Acta","","00167037","10.1016/j.gca.2010.01.017","https://linkinghub.elsevier.com/retrieve/pii/S0016703710000268","The deep-sea coral, Enallopsammia rostrata, a member of the Dendrophylliidae family, is a major structure-forming species that creates massive dendroid colonies, up to 1 m wide and 0.5 m tall. Living colonies of E. rostrata have been collected using the PISCES submersibles from three locations from 480 to 788 m water depth in the Line Islands ($160°W) in the Equatorial Paciﬁc. We have applied to these colonies a high sensitivity, low blank technique to determine U-series ages in small quantities (70 ± 15 mg) of modern and near modern calcareous skeletons using MC-ICP-MS (Multi-collector Inductively Coupled Plasma Mass Spectrometer). The application of this method to living slow-growing colonies from a range of sites as well as the observations of axial growth patterns in thin sections of their skeletons oﬀer the ﬁrst expanded and well constrained data on longevity, growth pattern and mean growth rates in E. rostrata. Absolute dated specimens indicate life spans of colonies ranging from 209 ± 8 yrs to 605 ± 7 yrs with radial growth rates from 0.012 to 0.072 mm yrÀ1 and vertical extension rates from 0.6 to 1.9 mm yrÀ1. The linear growth rates reported here are lower than those reported for other deep-sea scleractinian corals (Lophelia pertusa and Madrepora oculata). The U-series dating indicates that the growth ring patterns of E. rostrata are not consistent with annual periodicity emphasizing the importance of absolute radiometric dating methods to constrain growth rates. Slow accretion and extreme longevity make this species and its habitat especially vulnerable to disturbances and impacts from human activities. This dating method combined with observation of growth patterns opens up new perspectives in the ﬁeld of deep-sea corals since it can provide quantitative estimates of growth rates and longevity of deep-sea corals in general.","2010-04","2021-09-23 22:35:35","2021-09-23 22:35:35","2021-06-28 14:30:49","2380-2395","","8","74","","Geochimica et Cosmochimica Acta","Uranium-series dating and growth characteristics of the deep-sea scleractinian coral","","","","","","","en","","","","","DOI.org (Crossref)","","Number: 8","","","","annual periodicity,; cold-water corals,; collector mass-spectrometry,; desmophyllum-cristagalli,; gorgonian corals,; isotope ratios,; lophelia-pertusa,; mediterranean-sea,; northeast atlantic,; primnoa-resedaeformis,","","","","","","","","","","","","","","","","","","","","","","","","","","","","","","","","","","","","","","","","","","","","","","",""
"X2DKLK9H","journalArticle","2010","S. Knapp, Ingrid S","Effect of Depth on Sponge Assemblage Structure at Palmyra Atoll, Central Pacific","The Open Marine Biology Journal","","18744508","10.2174/1874450801004010026","http://benthamopen.com/ABSTRACT/TOMBJ-4-26","We examined the influence of depth on sponge assemblages across three lagoons at Palmyra; a remote atoll situated in the Central Pacific. The atoll is unusual in that it was heavily altered during WWII resulting in an atypical lagoon system. We conducted surveys at both 6-8m and 12-14m at 3 sites at the atoll and recorded sponge densities, area cover and available substrate for the 29 species found at these sites. Multivariate analysis of sponge densities and area cover revealed significant variability in sponge assemblages between both site and depth. Univariate analysis also showed significant differences in area cover between depths, but not between sites. Diversity indices and the average number of species at each site showed an increase in diversity across lagoons from West to East. This study indicates that despite the small size of the atoll, depth is a factor that shapes sponge assemblages at Palmyra Atoll. The heavy alterations to the lagoon, particularly the area near the channel entrance may be influencing the sponge assemblage structure, however, other environmental variables still need to be investigated.","2010-10-12","2021-09-23 22:35:35","2021-09-23 22:35:35","2021-06-28 14:30:52","26-30","","1","4","","TOMBJ","","","","","","","","en","","","","","DOI.org (Crossref)","","Number: 1","","","","Palmyra Atoll,; Central Pacific,; depth,; flow rate; sedimentation,; Sponge,","","","","","","","","","","","","","","","","","","","","","","","","","","","","","","","","","","","","","","","","","","","","","","",""
"Z74XI7AJ","journalArticle","2011","Knapp, I.S.; Godwin, L.S.; Smith, J.E.; Williams, C.J.; Bell, J.J.","Records of non-indigenous marine species at Palmyra Atoll in the US Line Islands","Marine Biodiversity Records","","1755-2672","10.1017/S1755267211000078","http://www.journals.cambridge.org/abstract_S1755267211000078","","2011-10","2021-09-23 22:35:35","2021-09-23 22:35:35","2021-06-28 14:30:55","e30","","","4","","Mar. Biodivers. Rec.","","","","","","","","en","","","","","DOI.org (Crossref)","","","","","","coral reef,; bryozoan,; hydroid,; introduction,; lagoon,; non-indigenous,; Palmyra Atoll; sponge, algae,","","","","","","","","","","","","","","","","","","","","","","","","","","","","","","","","","","","","","","","","","","","","","","",""
"XEYW4LFG","journalArticle","2013","Knapp, Ingrid S.S.; Williams, Gareth J.; Carballo, José Luis; Cruz-Barraza, José Antonio; Gardner, Jonathan P.A.; Bell, James J.","Restriction of sponges to an atoll lagoon as a result of reduced environmental quality","Marine Pollution Bulletin","","0025326X","10.1016/j.marpolbul.2012.08.017","https://linkinghub.elsevier.com/retrieve/pii/S0025326X12004171","The lagoon at Palmyra Atoll in the central Paciﬁc was subject to major military modiﬁcations during WWII and now the dominant fauna on the lagoon’s hard substrate are sponges, not corals. In this study, we quantiﬁed the physical and biological factors explaining the variation in sponge distribution patterns across 11 sites to determine the potential for the sponges in the lagoon at Palmyra to invade the surrounding reef systems. Signiﬁcant differences in sponge assemblages were found among all but three sites. For all the models we examined the strongest environmental relationships were found for variables related to sedimentation/turbidity and food/habitat availability. Our ﬁndings suggest that the sponges in Palmyra’s lagoon are likely to be restricted to this habitat type where they are associated with conditions resulting from the earlier heavy disturbance and are unlikely to spread to the outer reef environments unless there is a dramatic decline in environmental quality.","2013-01","2021-09-23 22:35:35","2021-09-23 22:35:35","2021-06-28 14:30:58","209-220","","1-2","66","","Marine Pollution Bulletin","","","","","","","","en","","","","","DOI.org (Crossref)","","Number: 1-2","","","","Animals,; Ecosystem,; Pacific Islands,; Environmental Monitoring,; Porifera/physiology,; Water Pollution/analysis/statistics & numerical data","","","","","","","","","","","","","","","","","","","","","","","","","","","","","","","","","","","","","","","","","","","","","","",""
"I2IG4XIP","journalArticle","2016","Knapp, Ingrid S.S; Williams, Gareth J.; Bell, James J.","Temporal dynamics and persistence of sponge assemblages in a Central Pacific atoll lagoon","Marine Ecology","","01739565","10.1111/maec.12303","http://doi.wiley.com/10.1111/maec.12303","Sponges are important components of coral reef fauna, although little is known of their temporal dynamics. Sponges dominate the lagoon system at Palmyra Atoll in the Central Paciﬁc, which may not be its natural state. Here we examined the temporal variability and recruitment rates of these sponge assemblages to determine if they are stable and examined the evidence that a recent transition has occurred from a coral- to sponge-dominated system. We found 24 sponge species in permanent quadrats in the lagoon between 2009 and 2011, and 11 species on our recruitment panels. The sponge assemblage composition and abundance did not vary signiﬁcantly between years and appear stable. Many sponge recruits were found in both years that the panels were examined although higher rates were recorded in the second year of the study. While it seems very possible that a change to a sponge-dominated lagoon is associated with declining environmental quality at Palmyra as a result of modiﬁcations over 70 years ago, without pre-modiﬁcation data on reef assemblage composition this remains speculative. Our observations of short-term temporal stability in the sponge assemblages at Palmyra highlight the potential for sponge-dominated reef states to be maintained in degraded reef environments that are seemingly unsuitable for coral survival.","2016-10","2021-09-23 22:35:35","2021-09-23 22:35:35","2021-06-28 14:31:04","1147-1153","","5","37","","Mar Ecol","","","","","","","","en","","","","","DOI.org (Crossref)","","Number: 5","","","","communities,; coral-reefs,; atoll,; coral reef,; abundance,; diversity,; pacific ocean,; lagoon,; phase shift,; sponge,; states","","","","","","","","","","","","","","","","","","","","","","","","","","","","","","","","","","","","","","","","","","","","","","",""
"5RDJZTLB","journalArticle","2008","Knowlton, Nancy; Jackson, Jeremy B. C","Shifting Baselines, Local Impacts, and Global Change on Coral Reefs","PLoS Biology","","1545-7885","10.1371/journal.pbio.0060054","https://dx.plos.org/10.1371/journal.pbio.0060054","","2008-02-26","2021-09-23 22:35:35","2021-09-23 22:35:35","2021-06-28 14:31:08","e54","","2","6","","PLoS Biol","","","","","","","","en","","","","","DOI.org (Crossref)","","Number: 2","","","","Animals,; Ecosystem,; Anthozoa,; Greenhouse Effect,; Hydrogen-Ion Concentration","","","","","","","","","","","","","","","","","","","","","","","","","","","","","","","","","","","","","","","","","","","","","","",""
"NCCX7K43","journalArticle","2015","Koweek, David; Dunbar, Robert B.; Rogers, Justin S.; Williams, Gareth J.; Price, Nichole; Mucciarone, David; Teneva, Lida","Environmental and ecological controls of coral community metabolism on Palmyra Atoll","Coral Reefs","","0722-4028, 1432-0975","10.1007/s00338-014-1217-3","http://link.springer.com/10.1007/s00338-014-1217-3","","2015-03","2021-09-23 22:35:35","2021-09-23 22:35:35","2021-06-28 14:31:11","339-351","","1","34","","Coral Reefs","","","","","","","","en","","","","","DOI.org (Crossref)","","Number: 1","","","","coral reefs,; climate-change,; calcification,; carbon-dioxide,; constants,; coral ecology,; dissociation,; eulerian measurements,; fluxes; impacts,; lagrangian drifts,; net community calcification,; net community production,; ocean acidification,; reefs,; seawater,","","","","","","","","","","","","","","","","","","","","","","","","","","","","","","","","","","","","","","","","","","","","","","",""
"JUM8RJ2A","journalArticle","2010","Lafferty, Kevin D.; Hathaway, Stacie A.; Wegmann, Alex S.; Shipley, Frank S.; Backlin, Adam R.; Helm, Joel; Fisher, Robert N.","Stomach Nematodes (Mastophorus muris) in Rats (Rattus rattus) Are Associated with Coconut (Cocos nucifera) Habitat at Palmyra Atoll","Journal of Parasitology","","0022-3395, 1937-2345","10.1645/GE-2180.1","http://www.bioone.org/doi/abs/10.1645/GE-2180.1","Black rats (Rattus rattus) and their stomach nematodes (Mastophorus muris) were historically introduced to islets at Palmyra Atoll in the central Pacific Line Islands. To investigate patterns of parasitism, we trapped rats and quantified nematodes on 13 islets of various sizes and habitat types. Most rats were parasitized (59%) with an average of 12 worms per infected rat. Islet size did not greatly influence parasite population biology. Nematodes also did not appear to affect rat condition (weight to skull length). The only strong and consistent factor associated with the mean abundance of nematodes in rats was habitat (dominant cover and locally dominant plant species). Thus, nematodes were much more abundant in rats from sites dominated by coconut trees (Cocos nucifera). Coconut trees may also be an introduced species at Palmyra Atoll.","2010-02","2021-09-23 22:35:35","2021-09-23 22:35:35","2021-06-28 14:31:17","16-20","","1","96","","Journal of Parasitology","","","","","","","","en","","","","","DOI.org (Crossref)","","Number: 1","","","","Animals,; Ecosystem,; Cocos/growth & development,; Prevalence,; Female,; Male,; Linear Models,; Nematode Infections/epidemiology/parasitology,; Polynesia/epidemiology,; Rats/parasitology,; Rodent Diseases/epidemiology/parasitology,; Stomach Diseases/epidemiology/parasitology/veterinary; Veterinary,","","","","","","","","","","","","","","","","","","","","","","","","","","","","","","","","","","","","","","","","","","","","","","",""
"J7C4CTEJ","journalArticle","2018","Lafferty, Kevin D.; McLaughlin, John P.; Gruner, Daniel S.; Bogar, Taylor A.; Bui, An; Childress, Jasmine N.; Espinoza, Magaly; Forbes, Elizabeth S.; Johnston, Cora A.; Klope, Maggie; Miller-ter Kuile, Ana; Lee, Michelle; Plummer, Katherine A.; Weber, David A.; Young, Ronald T.; Young, Hillary S.","Local extinction of the Asian tiger mosquito ( <i>Aedes albopictus</i> ) following rat eradication on Palmyra Atoll","Biology Letters","","1744-9561, 1744-957X","10.1098/rsbl.2017.0743","https://royalsocietypublishing.org/doi/10.1098/rsbl.2017.0743","The Asian tiger mosquito,               Aedes albopictus,               appears to have been extirpated from Palmyra Atoll following rat eradication. Anecdotal biting reports, collection records, and regular captures in black-light traps showed the species was present before rat eradication. Since then, there have been no biting reports and no captures over 2 years of extensive trapping (black-light and scent traps). By contrast, the southern house mosquito,               Culex quinquefasciatus,               was abundant before and after rat eradication. We hypothesize that mammals were a substantial and preferred blood meal for               Aedes               , whereas               Culex               feeds mostly on seabirds. Therefore, after rat eradication, humans and seabirds alone could not support positive population growth or maintenance of               Aedes               . This seems to be the first documented accidental secondary extinction of a mosquito. Furthermore, it suggests that preferred host abundance can limit mosquito populations, opening new directions for controlling important disease vectors that depend on introduced species like rats.","2018-02","2021-09-23 22:35:35","2021-09-23 22:35:35","2021-06-28 14:31:20","20170743","","2","14","","Biol. Lett.","","","","","","","","en","","","","","DOI.org (Crossref)","","Number: 2","","","","Animals,; Aedes/physiology,; Culex,; Extinction, Biological,; extirpation,; Introduced Species,; Islands,; Mosquito Vectors/physiology,; Rats,; Rattus,; secondary extinction","","","","","","","","","","","","","","","","","","","","","","","","","","","","","","","","","","","","","","","","","","","","","","",""
"2VSUUFY4","journalArticle","2011","Madin, Emp; Madin, Js","Predators, facilitators, or both? Re-evaluating an apparent predator–prey relationship","Marine Ecology Progress Series","","0171-8630, 1616-1599","10.3354/meps09162","http://www.int-res.com/abstracts/meps/v431/p299-302/","Predators and prey are occasionally observed to comingle in close proximity on coral reefs. Both lethal and non-lethal (i.e. behavioral) effects of predators on prey are well documented. However, observations of apparent predator–prey interactions between the piscivorous twinspot snapper Lutjanus bohar and the herbivorous surgeonfish Acanthurus triostegus suggest that the nature of their association may be context-dependent. The context-dependent nature of some species interactions is well-known, and in some cases a single species has been shown to act as both predator and facilitator to its prey. We present incidental in situ observations suggesting that, in the context of voraciously grazing schools of A. triostegus, this species pair may also engage in a facultative mutualistic relationship. Specifically, we propose that within this context, both species may indirectly derive a benefit through changes in the behavior and/or density of territorial damselfishes driven by both L. bohar and A. triostegus. We provide prescriptions for rigorously testing this hypothesis and suggest that re-evaluation of this, and possibly other, ostensibly exclusive predator–prey pairs in marine systems may reveal unexpected relationships. Given the relative lack of examples of such interactions involving the same predator acting as both facilitator and predator from marine versus terrestrial systems, coupled with this preliminary evidence, we propose that this topic is ripe for exploration.","2011-06-09","2021-09-23 22:35:35","2021-09-23 22:35:35","2021-06-28 14:31:23","299-302","","","431","","Mar. Ecol. Prog. Ser.","Predators, facilitators, or both?","","","","","","","en","","","","","DOI.org (Crossref)","","","","","","Coral reef,; Facilitation,; Facultative mutualism,; Fish behavior; Predator–prey interaction,","","","","","","","","","","","","","","","","","","","","","","","","","","","","","","","","","","","","","","","","","","","","","","",""
"F8LMGUQG","journalArticle","2010","Madin, Elizabeth M. P.; Gaines, Steven D.; Madin, Joshua S.; Warner, Robert R.","Fishing Indirectly Structures Macroalgal Assemblages by Altering Herbivore Behavior","The American Naturalist","","0003-0147, 1537-5323","10.1086/657039","https://www.journals.uchicago.edu/doi/10.1086/657039","Fishing has clear direct effects on harvested species, but its cascading, indirect effects are less well understood. Fishing disproportionately removes larger, predatory ﬁshes from marine food webs. Most studies of the consequent indirect effects focus on density-mediated interactions where predator removal alternately drives increases and decreases in abundances of successively lower trophic-level species. While prey may increase in number with fewer predators, they may also alter their behavior. When such behavioral responses impact the food resources of prey species, behaviorally mediated trophic cascades can dramatically shape landscapes. It remains unclear whether this pathway of change is typically triggered by ocean ﬁshing. By coupling a simple foraging model with empirical observations from coral reefs, we provide a mechanistic basis for understanding and predicting how predator harvest can alter the landscape of risk for herbivores and consequently drive dramatic changes in primary producer distributions. These results broaden trophic cascade predictions for ﬁsheries to include behavioral changes. They also provide a framework for detecting the presence and magnitude of behaviorally mediated cascades. This knowledge will help to reconcile the disparity between expected and observed patterns of ﬁshing-induced cascades in the sea.","2010-12","2021-09-23 22:35:35","2021-09-23 22:35:35","2021-06-28 14:31:29","785-801","","6","176","","The American Naturalist","","","","","","","","en","","","","","DOI.org (Crossref)","","Number: 6","","","","Animals,; Fisheries,; Models, Biological,; Coral Reefs,; Food Chain,; Predatory Behavior,; Population Density,; Population Dynamics,; Seaweed/physiology","","","","","","","","","","","","","","","","","","","","","","","","","","","","","","","","","","","","","","","","","","","","","","",""
"B4Z29NFV","book","2011","","Encyclopedia of Modern Coral Reefs: Structure, Form and Process","","978-90-481-2638-5 978-90-481-2639-2","","","http://link.springer.com/10.1007/978-90-481-2639-2","","2011","2021-09-23 22:35:35","2021-09-23 22:35:35","2021-06-28 14:31:32","","","","","","","Encyclopedia of Modern Coral Reefs","Encyclopedia of Earth Sciences Series","","","","Springer Netherlands","Dordrecht","en","","","","","DOI.org (Crossref)","","DOI: 10.1007/978-90-481-2639-2","","","","","","Hopley, David","","","","","","","","","","","","","","","","","","","","","","","","","","","","","","","","","","","","","","","","","","","","",""
"Z5AK69WG","bookSection","2008","Maragos, James; Friedlander, Alan M.; Godwin, Scott; Musburger, Craig; Tsuda, Roy; Flint, Elizabeth; Pantos, Olga; Ayotte, Paula; Sala, Enric; Sandin, Stuart; McTee, Sarah; Siciliano, Daria; Obura, David","US Coral Reefs in the Line and Phoenix Islands, Central Pacific Ocean: Status, Threats and Significance","Coral Reefs of the USA","978-1-4020-6846-1 978-1-4020-6847-8","","","http://link.springer.com/10.1007/978-1-4020-6847-8_16","","2008","2021-09-23 22:35:35","2021-09-23 22:35:35","2021-06-28 14:31:35","643-654","","","1","","","US Coral Reefs in the Line and Phoenix Islands, Central Pacific Ocean","","","","","Springer Netherlands","Dordrecht","en","","","","","DOI.org (Crossref)","","DOI: 10.1007/978-1-4020-6847-8_16","","","","","","Riegl, Bernhard M.; Dodge, Richard E.","","","","","","","","","","","","","","","","","","","","","","","","","","","","","","","","","","","","","","","","","","","","",""
"YQR5U37T","bookSection","2008","Maragos, James; Miller, Joyce; Gove, Jamison; De Martini, Edward; Friedlander, Alan M.; Godwin, Scott; Musburger, Craig; Timmers, Molly; Tsuda, Roy; Vroom, Peter; Flint, Elizabeth; Lundblad, Emily; Weiss, Jonathan; Ayotte, Paula; Sala, Enric; Sandin, Stuart; McTee, Sarah; Wass, Todd; Siciliano, Daria; Brainard, Russell; Obura, David; Ferguson, Scott; Mundy, Bruce","US Coral Reefs in the Line and Phoenix Islands, Central Pacific Ocean: History, Geology, Oceanography, and Biology","Coral Reefs of the USA","978-1-4020-6846-1 978-1-4020-6847-8","","","http://link.springer.com/10.1007/978-1-4020-6847-8_15","","2008","2021-09-23 22:35:35","2021-09-23 22:35:35","2021-06-28 14:31:39","595-641","","","","","","US Coral Reefs in the Line and Phoenix Islands, Central Pacific Ocean","","","","","Springer Netherlands","Dordrecht","en","","","","","DOI.org (Crossref)","","DOI: 10.1007/978-1-4020-6847-8_15","","","","","","Riegl, Bernhard M.; Dodge, Richard E.","","","","","","","","","","","","","","","","","","","","","","","","","","","","","","","","","","","","","","","","","","","","",""
"7D52XNB6","journalArticle","2010","McCauley, Douglas J.; Papastamatiou, Yannis P.; Young, Hillary S.","An Observation of Mating in Free-Ranging Blacktip Reef Sharks, <i>Carcbarbinus melanopterus</i>","Pacific Science","","0030-8870, 1534-6188","10.2984/64.2.349","http://www.bioone.org/doi/10.2984/64.2.349","We describe the mating behavior of free-ranging Blacktip Reef Sharks, Carcharhinus melanopterus, at Palmyra Atoll. This is the ﬁrst primary report of mating in C. melanopterus and the ﬁrst direct observation of mating for an obligate swimming shark species. Similar to that in other nonobligate swimming shark species, mating in C. melanopterus was characterized by multiple males following a single female, a male grabbing the female near the pectoral ﬁn and positioning her head down on the bottom, and the insertion of a single clasper. Copulation lasted 68 sec, which is shorter than the durations recorded for most other shark species.","2010-04","2021-09-23 22:35:35","2021-09-23 22:35:35","2021-06-28 14:31:44","349-352","","2","64","","Pacific Science","","","","","","","","en","","","","","DOI.org (Crossref)","","Number: 2","","","","","","","","","","","","","","","","","","","","","","","","","","","","","","","","","","","","","","","","","","","","","","","","","","",""
"4N6MK5B6","journalArticle","2010","McCauley, Douglas J.; Micheli, Fiorenza; Young, Hillary S.; Tittensor, Derek P.; Brumbaugh, Daniel R.; Madin, Elizabeth M. P.; Holmes, Katherine E.; Smith, Jennifer E.; Lotze, Heike K.; DeSalles, Paul A.; Arnold, Suzanne N.; Worm, Boris","Acute effects of removing large fish from a near-pristine coral reef","Marine Biology","","0025-3162, 1432-1793","10.1007/s00227-010-1533-2","http://link.springer.com/10.1007/s00227-010-1533-2","","2010-12","2021-09-23 22:35:35","2021-09-23 22:35:35","2021-06-28 14:31:47","2739-2750","","12","157","","Mar Biol","","","","","","","","en","","","","","DOI.org (Crossref)","","Number: 12","","","","Macroalgae,; Benthic Alga,; Crustose Coralline Alga; Large Fish,; Percent Cover,","","","","","","","","","","","","","","","","","","","","","","","","","","","","","","","","","","","","","","","","","","","","","","",""
